disease,description,success
Hirschsprung disease-ganglioneuroblastoma syndrome,"Hirschsprung disease-ganglioneuroblastoma syndrome, a rare genetic disorder caused by pathogenic mutations, is characterized by developmental defects during embryogenesis that result in total or partial colonic aganglionosis alongside multifocal neuroblastic tumors.",True
eosinophilia-myalgia syndrome,"eosinophilia-myalgia syndrome, a rare multisystem disorder characterized by severe muscle pain, skin rashes, and lung complications, often linked to elevated eosinophils and triggered by contaminated L-tryptophan supplements.",True
lung disease,"lung disease, a collective term for conditions that impair normal lung function—often due to smoking, infections, environmental factors, or genetics—and include disorders such as COPD, asthma, and lung cancer.",True
primary hyperoxaluria,"primary hyperoxaluria, a rare genetic metabolic disorder caused by liver enzyme deficiencies leading to excess oxalate production, recurrent kidney stones, and progressive kidney damage.",True
"influenza, severe, susceptibility to","influenza, severe, susceptibility to, a condition in which a combination of genetic factors, chronic health issues, and environmental exposures increases an individual's risk of developing serious influenza complications such as acute respiratory illness and hospitalization.",True
X-linked severe congenital neutropenia,"X-linked severe congenital neutropenia, an X-linked recessive immunodeficiency syndrome caused by mutations in the WAS gene, is characterized by severe congenital neutropenia, monocytopenia, and recurrent, life-threatening bacterial infections beginning in infancy.",True
lung cancer,"lung cancer, a malignant tumor originating in lung tissues from uncontrolled cell growth, primarily caused by smoking and environmental factors, and recognized as the leading cause of cancer-related deaths worldwide.",True
long QT syndrome,"long QT syndrome, a heart rhythm disorder that affects the heart's electrical system and can cause irregular, potentially life-threatening arrhythmias leading to fainting or sudden death.",True
adrenal gland pheochromocytoma,"adrenal gland pheochromocytoma, a rare neuroendocrine tumor arising from adrenal chromaffin cells that leads to excess catecholamine production and symptoms such as high blood pressure.",True
cor pulmonale,"cor pulmonale, a condition characterized by right ventricular enlargement and eventual failure due to pulmonary hypertension caused by chronic lung disorders.",True
obsolete neurogenic bladder (disease),"obsolete neurogenic bladder (disease), is a condition in which nerve damage or dysfunction impairs the communication between the brain, spinal cord, and bladder, leading to abnormal urinary storage and voiding.",True
CD4+/CD56+ hematodermic neoplasm,"CD4+/CD56+ hematodermic neoplasm, a rare and highly aggressive hematologic malignancy that initially presents with distinctive skin lesions and rapidly disseminates to lymph nodes, bone marrow, and peripheral blood, is characterized by a CD4+/CD56+ (often CD123-positive) immunophenotype indicative of plasmacytoid dendritic cell origin.",True
endometrial cancer,"endometrial cancer, a type of uterine cancer originating in the lining of the uterus that is often linked to high estrogen levels and treated through methods such as surgery, radiation, chemotherapy, or hormone therapy.",True
hepatitis B virus infection,"hepatitis B virus infection, a liver disease caused by the hepatitis B virus that can be acute or chronic and is spread through infected blood and body fluids.",True
Dravet syndrome,"Dravet syndrome, a rare genetic epileptic encephalopathy that begins in infancy with severe, difficult-to-control seizures and is associated with developmental delays, cognitive impairment, and behavioral challenges.",True
intestinal impaction,"intestinal impaction, a condition in which hardened stool becomes lodged in the colon or rectum due to chronic constipation, causing severe abdominal discomfort and difficulty passing stool.",True
macrocytic anemia (disease),"macrocytic anemia (disease), a blood disorder characterized by oversized red blood cells primarily due to deficiencies in vitamin B12 or folate, certain medications, or other underlying conditions that impair DNA synthesis and normal red blood cell production.",True
intestinal obstruction,"intestinal obstruction, a blockage that prevents food, fluids, and gas from passing through the digestive tract, potentially resulting in severe abdominal pain and life-threatening complications.",True
acromegaly,"acromegaly, a rare hormonal disorder caused by excess growth hormone production after puberty that leads to abnormal enlargement of bones, tissues, and organs.",True
tertiary lesion of yaws,"tertiary lesion of yaws, a late-stage complication of untreated yaws that typically develops 5 to 10 years after initial infection and is marked by severe, destructive lesions affecting the skin, bones, and joints.",True
blepharoconjunctivitis,"blepharoconjunctivitis, an ophthalmic condition characterized by inflammation of both the eyelids and the conjunctiva, leading to redness, irritation, crusting, and discomfort.",True
black piedra,"black piedra, a superficial fungal infection caused by Piedraia hortae that forms small, hard black nodules on hair shafts, primarily occurring in warm, humid tropical regions.",True
macular retinal edema,"macular retinal edema, a condition characterized by fluid leakage into the central part of the retina (the macula), leading to swelling and impaired sharp, central vision.",True
toxic shock syndrome,"toxic shock syndrome, a rare but life-threatening condition caused by toxins released from staph or strep bacteria that can lead to rapid, multi-organ damage.",True
peptic ulcer disease,"peptic ulcer disease, a condition characterized by open sores in the stomach or duodenum typically caused by Helicobacter pylori infection or NSAID use.",True
injury,"injury, a physical harm or damage to living tissue caused by external factors such as accidents, trauma, or environmental extremes.",True
stone in bladder diverticulum,"stone in bladder diverticulum, a condition in which minerals in stagnant urine crystallize within a bladder diverticulum, potentially causing pain, hematuria, and recurrent infections.",True
Burkitt lymphoma,"Burkitt lymphoma, a rare and aggressive B-cell non-Hodgkin lymphoma characterized by rapid growth, a distinctive starry-sky pattern on pathology, and frequent association with Epstein-Barr virus.",True
exposure keratitis,"exposure keratitis, a condition marked by corneal damage and inflammation from inadequate eyelid closure that leads to dryness, irritation, and potential ulceration and vision loss.",True
frozen shoulder,"frozen shoulder, a condition characterized by gradually worsening shoulder pain, stiffness, and reduced motion that typically resolves within one to three years.",True
invasive non-typhoidal salmonellosis,"invasive non-typhoidal salmonellosis, a severe, life-threatening extraintestinal infection caused by non-typhoidal Salmonella serotypes that predominantly affects immunocompromised and vulnerable individuals, leading to systemic complications and high mortality.",True
cystitis,"cystitis, an inflammation of the bladder most often caused by a bacterial infection that leads to symptoms like frequent urination and discomfort and is typically treated with antibiotics.",True
variola major infectious disease,"variola major infectious disease, a severe form of smallpox caused by the variola virus that led to high fever, a progressive skin rash, and a mortality rate exceeding 30%.",True
ventricular tachycardia,"ventricular tachycardia, a fast and abnormal heart rhythm originating in the heart's ventricles that can be life-threatening.",True
inherited lipid metabolism disorder,"inherited lipid metabolism disorder, a genetic condition caused by enzyme deficiencies that impede the normal breakdown and utilization of lipids, leading to their abnormal accumulation in tissues.",True
gastric cancer,"gastric cancer, a malignant tumor that originates in the inner lining of the stomach and gradually invades its walls, often leading to symptoms like unexplained weight loss and stomach pain.",True
appendicitis,"appendicitis, an inflammation of the appendix causing lower right abdominal pain, nausea, and fever that often requires urgent surgical removal to prevent serious complications.",True
intermittent vascular claudication,"intermittent vascular claudication, a manifestation of peripheral arterial disease characterized by exercise-induced leg muscle pain, cramping, or fatigue that is relieved by brief periods of rest.",True
gestational trophoblastic neoplasm,"gestational trophoblastic neoplasm, a rare malignant tumor arising from the abnormal proliferation of trophoblastic cells during or after pregnancy.",True
systemic sclerosis,"systemic sclerosis, a rare autoimmune disorder characterized by widespread fibrosis and vascular damage affecting the skin and internal organs.",True
endomyometritis,"endomyometritis, inflammation of the uterine lining and muscle often resulting from infection following childbirth or abortion.",True
neoplasm of mature B-cells,"neoplasm of mature B-cells, is a malignant disorder originating from mature B-lymphocytes or plasma cells that encompasses a heterogeneous spectrum of non-Hodgkin lymphomas and leukemias with variable clinical behavior and treatment strategies.",True
autosomal recessive distal myopathy,"autosomal recessive distal myopathy, is a rare inherited muscular disorder that typically presents in early adulthood with progressive weakness and atrophy of the distal lower limb muscles, often accompanied by rimmed vacuoles on muscle biopsy.",True
staphylococcal infection,"staphylococcal infection, a bacterial disease caused by Staphylococcus species that can affect the skin, lungs, heart, and other organs, leading to conditions ranging from minor skin infections to serious systemic illnesses.",True
familial hyperprolactinemia,"familial hyperprolactinemia, a rare genetic endocrine disorder characterized by persistently elevated prolactin levels in multiple family members—absent triggers like gestation, drug intake, or pituitary tumors—that results in symptoms typical of hyperprolactinemia such as menstrual irregularities and galactorrhea.",True
scabies,"scabies, a contagious skin infestation caused by tiny mites that burrow into the skin and lay eggs, leading to intense itching and rash.",True
congenital osteogenesis imperfecta-microcephaly-cataracts syndrome,"congenital osteogenesis imperfecta-microcephaly-cataracts syndrome, a rare genetic disorder characterized by osteogenesis imperfecta with multiple prenatal bone fractures, joint laxity, severe microcephaly, and bilateral cataracts.",True
thyroid cancer,"thyroid cancer, a disease characterized by abnormal cell growth in the thyroid gland that can disrupt hormone production and potentially spread, with several variants that determine its treatment and prognosis.",True
Waardenburg syndrome,"Waardenburg syndrome, a group of rare genetic disorders that cause congenital hearing loss and pigmentary abnormalities affecting the hair, eyes, and skin.",True
familial visceral myopathy,"familial visceral myopathy, a rare genetic disorder characterized by myopathic degeneration of the smooth muscle in the gastrointestinal and urinary tracts leading to chronic intestinal pseudo-obstruction and variable symptoms such as abdominal distension, pain, vomiting, and altered bowel and bladder function.",True
epithelioid hemangioendothelioma,"epithelioid hemangioendothelioma, a rare vascular tumor originating in blood vessel lining cells that can develop in various organs.",True
partial epilepsy,"partial epilepsy, a neurological condition marked by focal seizures originating in a specific brain region that may affect or spare a person’s level of awareness.",True
acute neonatal citrullinemia type I,"acute neonatal citrullinemia type I, a severe autosomal recessive urea cycle disorder manifesting within days of birth with hyperammonemia, progressive lethargy, poor feeding, vomiting, seizures, and potential increased intracranial pressure.",True
gastroesophageal reflux disease,"gastroesophageal reflux disease, a chronic condition in which stomach acid persistently flows back into the esophagus causing symptoms such as heartburn, chest pain, and esophageal irritation.",True
gingivitis,"gingivitis, an inflammation of the gums caused by bacterial plaque buildup that leads to redness, swelling, and bleeding.",True
thallium poisoning,"thallium poisoning, a severe condition caused by exposure to highly toxic thallium compounds that disrupt intracellular potassium processes and result in gastrointestinal, neurologic, and dermatologic symptoms through ingestion, inhalation, or skin contact.",True
scrub typhus,"scrub typhus, a mite-borne infectious disease caused by Orientia tsutsugamushi and transmitted by chigger bites, typically presenting with fever, headache, rash, and potential severe complications.",True
bronchiectasis,"bronchiectasis, a chronic lung disease characterized by permanent airway dilation that leads to mucus accumulation and recurrent infections.",True
urolithiasis,"urolithiasis, a condition characterized by the formation of hard mineral and salt stones in the urinary tract—primarily in the kidneys and ureters—that can cause pain, urinary obstruction, and may require medical or surgical treatment.",True
sinoatrial block,"sinoatrial block, a disorder in which electrical impulses originating from the sinoatrial node are delayed or blocked from reaching the atria, resulting in disrupted heart rhythms.",True
Yersinia infectious disease,"Yersinia infectious disease, also known as yersiniosis, is a bacterial gastrointestinal infection primarily caused by Yersinia enterocolitica or Yersinia pseudotuberculosis, often acquired by consuming contaminated or undercooked food.",True
acute contagious conjunctivitis,"acute contagious conjunctivitis, an acute eye infection that is highly contagious—typically caused by viruses like adenovirus or bacteria—and characterized by red, irritated eyes with watery or purulent discharge that spreads easily through contact with contaminated hands or surfaces.",True
newborn respiratory distress syndrome,"newborn respiratory distress syndrome, is a breathing disorder primarily seen in premature infants due to underdeveloped lungs and insufficient surfactant production that causes respiratory distress shortly after birth.",True
infectious disease,"infectious disease, a medical condition caused by pathogenic microorganisms such as viruses, bacteria, fungi, parasites, and prions that can spread from person to person and is managed through prevention measures like vaccination, hygiene, and appropriate treatments.",True
hepatic veno-occlusive disease-immunodeficiency syndrome,"hepatic veno-occlusive disease-immunodeficiency syndrome, is a rare autosomal recessive disorder that typically presents within the first six months of life with severe combined immunodeficiency and progressive liver injury due to occlusion of small hepatic veins leading to fibrosis and hepatomegaly.",True
fungal infectious disease,"fungal infectious disease, a condition caused by pathogenic fungi that can affect the skin, nails, lungs, and other organs, ranging from mild irritation to life-threatening systemic infections, especially in individuals with weakened immune systems.",True
double outlet right ventricle with subaortic or doubly committed ventricular septal defect with pulmonary stenosis,"double outlet right ventricle with subaortic or doubly committed ventricular septal defect with pulmonary stenosis, a congenital heart defect where both great arteries predominantly arise from the right ventricle through a ventricular septal defect positioned beneath one or both arterial outlets, accompanied by narrowing of the pulmonary outflow tract.",True
granulomatous slack skin disease,"granulomatous slack skin disease, a rare and indolent variant of mycosis fungoides characterized by lax, pendulous skin folds due to granulomatous T-cell infiltrates and elastic fiber loss, often seen in middle-aged adults and associated with other lymphoproliferative disorders.",True
autosomal dominant limb-girdle muscular dystrophy type 1D (DNAJB6),"autosomal dominant limb-girdle muscular dystrophy type 1D (DNAJB6), is an adult-onset, slowly progressive muscle disorder caused by mutations in the DNAJB6 gene that primarily leads to proximal pelvic muscle weakness with minimal shoulder involvement and is characterized by abnormal protein aggregates in muscle fibers without significant cardiac or respiratory compromise.",True
thrombocytosis disease,"thrombocytosis disease, a condition marked by an abnormally high platelet count in the blood that can result from reactive processes to underlying conditions or from primary bone marrow disorders such as essential thrombocythemia, potentially leading to complications like clot formation and bleeding.",True
intellectual disability,"intellectual disability, a neurodevelopmental condition characterized by significant limitations in intellectual functioning and adaptive behavior that typically emerge before age 18 and affect daily living skills.",True
pulmonary edema,"pulmonary edema, a condition marked by the abnormal accumulation of fluid in the lungs that interferes with oxygen exchange and can lead to severe, life-threatening respiratory distress.",True
phlebitis,"phlebitis, an inflammation of a vein often triggered by a blood clot, trauma, or infection that can cause pain, swelling, and redness.",True
severe pre-eclampsia,"severe pre-eclampsia, a life-threatening pregnancy disorder characterized by extremely high blood pressure and signs of organ dysfunction that can quickly jeopardize the health of both mother and baby and may require prompt delivery.",True
juvenile Huntington disease,"juvenile Huntington disease, a rare, early-onset form of Huntington’s disease that begins in childhood or adolescence and is marked by progressive motor, cognitive, and behavioral decline due to a genetic mutation in the huntingtin gene.",True
Down syndrome,"Down syndrome, a genetic disorder caused by an extra copy of chromosome 21 resulting in developmental delays, intellectual disability, and distinct physical features.",True
rhinitis,"rhinitis, an inflammation of the nasal lining that typically results in symptoms such as congestion, sneezing, runny nose, and itching due to various triggers including allergens, irritants, and infections.",True
otitis externa,"otitis externa, a common inflammatory condition of the external ear canal typically caused by bacterial or fungal infection or irritation and often linked to water exposure.",True
hepatorenal syndrome,"hepatorenal syndrome, is a life-threatening complication of advanced liver disease that results in rapid, functional kidney failure without intrinsic kidney damage.",True
cardiac tamponade,"cardiac tamponade, a life-threatening emergency where fluid or blood accumulates in the pericardial sac, compressing the heart and hindering its ability to fill and pump blood effectively.",True
nephrogenic diabetes insipidus,"nephrogenic diabetes insipidus, a kidney disorder in which the kidneys are unresponsive to antidiuretic hormone, leading to excessive urination and dehydration.",True
infective endocarditis,"infective endocarditis, a serious infection of the heart lining and valves typically caused by bacteria or fungi that can lead to severe complications if not promptly treated.",True
anemia of prematurity,"anemia of prematurity, a condition in preterm infants characterized by normocytic, hyporegenerative anemia resulting from low erythropoietin levels, incomplete iron transfer, and blood sampling losses.",True
X-linked adrenoleukodystrophy,"X-linked adrenoleukodystrophy, a rare genetic disorder caused by impaired peroxisomal fatty acid oxidation leading to the accumulation of very long-chain fatty acids that progressively damage the nervous system’s white matter and adrenal cortex.",True
balanitis,"balanitis, an inflammation of the glans penis (and sometimes the foreskin) commonly caused by infections, poor hygiene, or reactive arthritis that results in irritation, swelling, and sometimes lesions.",True
non-syndromic male infertility due to sperm motility disorder,"non-syndromic male infertility due to sperm motility disorder, is a rare genetic condition characterized by defects in the sperm’s cilia/flagella that result in absent or reduced motility in ejaculate.",True
candidemia,"candidemia, a serious bloodstream infection caused by Candida species that can lead to invasive disease with high morbidity and mortality.",True
neurotrophic keratopathy,"neurotrophic keratopathy, a degenerative corneal condition caused by impaired nerve function leading to reduced sensation, epithelial breakdown, and potential ulceration and perforation.",True
obsolete left bundle branch block,"obsolete left bundle branch block, is a cardiac conduction abnormality marked by a delay or blockage in the left bundle branch that alters the normal electrical activation of the left ventricle, often indicating underlying heart disease.",True
cervicofacial actinomycosis,"cervicofacial actinomycosis, is a rare, chronic, and invasive bacterial infection of the head and neck caused by Actinomyces species, typically following dental or orofacial trauma and characterized by abscess formation, tissue fibrosis, and draining sinus tracts.",True
epidermodysplasia verruciformis,"epidermodysplasia verruciformis, a rare genetic skin disorder marked by wart-like lesions from persistent HPV infections and a heightened risk of developing skin cancer.",True
sideroblastic anemia,"sideroblastic anemia, a disorder in which the bone marrow produces abnormal ringed sideroblasts due to impaired incorporation of iron into hemoglobin, leading to ineffective red blood cell production.",True
echinococcus granulosus infectious disease,"echinococcus granulosus infectious disease, a parasitic zoonosis also known as cystic echinococcosis or hydatid disease, occurs when humans ingest eggs from the dog tapeworm Echinococcus granulosus, leading to slowly growing fluid-filled cysts in organs such as the liver and lungs.",True
mycetoma,"mycetoma, a chronic, progressive subcutaneous infection caused by soil-derived bacteria or fungi that form painless masses, sinus tracts, and grains and may eventually involve deeper tissues and bones.",True
pancytopenia,"pancytopenia, a condition characterized by abnormally low levels of red blood cells, white blood cells, and platelets that can result from factors affecting bone marrow function such as infections, medications, cancers, or autoimmune diseases.",True
intracranial arteriosclerosis,"intracranial arteriosclerosis, a condition marked by plaque buildup in the brain's arteries that narrows the vessels and reduces blood flow, thereby elevating the risk of ischemic stroke.",True
malignant non-dysgerminomatous germ cell tumor of ovary,"malignant non-dysgerminomatous germ cell tumor of ovary, a rare malignant ovarian cancer arising from germ cells that typically presents unilaterally in adolescents with a pelvic mass, systemic symptoms such as fever and vaginal bleeding, and may involve hormonal manifestations depending on the tumor subtype.",True
anorexia nervosa,"anorexia nervosa, an eating disorder characterized by self-imposed food restriction, distorted body image, and an intense fear of weight gain that leads to dangerously low body weight.",True
anaplastic oligodendroglioma,"anaplastic oligodendroglioma, a rare and aggressive WHO grade III brain tumor originating from oligodendrocytes that typically presents with seizures and is managed through surgery, radiation, and chemotherapy.",True
hereditary neurocutaneous angioma,"hereditary neurocutaneous angioma, is a rare autosomal dominant disorder characterized by multiple angiomatous lesions on the skin and central nervous system.",True
endogenous depression,"endogenous depression, a subtype of major depressive disorder arising from internal genetic and biological factors without clear external triggers and typically managed with similar treatments as other forms of depression.",True
Hirschsprung disease-type D brachydactyly syndrome,"Hirschsprung disease-type D brachydactyly syndrome, a rare genetic disorder characterized by Hirschsprung disease and the absence or underdevelopment of the nails and distal phalanges of the thumbs and great toes.",True
neoplasm of esophagus,"neoplasm of esophagus, a malignant tumor arising from the esophageal lining that progresses from early asymptomatic stages to advanced disease with potential local invasion and distant metastasis.",True
humoral hypercalcemia of malignancy,"humoral hypercalcemia of malignancy, is a cancer-associated syndrome primarily resulting from tumor secretion of parathyroid hormone-related peptide (PTHrP) that increases osteoclastic bone resorption and elevates blood calcium levels.",True
albinism,"albinism, a genetic disorder that reduces or eliminates melanin production, resulting in little or no pigmentation in the skin, hair, and eyes and frequently leading to vision problems and increased sensitivity to sunlight.",True
toxic epidermal necrolysis,"toxic epidermal necrolysis, a life-threatening condition marked by extensive blistering and peeling of the skin and mucous membranes, typically triggered by adverse reactions to medications.",True
