disease,description,success
fungal infection of eye,"fungal infection of eye, a rare condition typically caused by fungal entry through injury or environmental exposure that results in symptoms such as pain, redness, blurred vision, and excessive tearing, and can lead to serious complications including permanent vision loss if not treated promptly.",True
sickle cell disease and related diseases,"sickle cell disease and related diseases, a group of inherited hemoglobin disorders that cause red blood cells to become misshapen and lead to various health complications.",True
X-linked adrenal hypoplasia congenita,"X-linked adrenal hypoplasia congenita, is a rare X-linked recessive disorder caused by mutations in the NR0B1 gene that disrupt adrenal gland development and hormone production, often resulting in primary adrenal insufficiency and hypogonadotropic hypogonadism.",True
hydroa vacciniforme,"hydroa vacciniforme, a rare photosensitivity disorder typically beginning in childhood, is characterized by painful, sun-induced vesicular skin lesions that heal with varioliform scarring and may be associated with Epstein-Barr virus infection.",True
obsolete bundle branch block,"obsolete bundle branch block, a condition marked by a delay or interruption in one of the heart's ventricular conduction pathways that produces widened, misshapen QRS complexes on an electrocardiogram.",True
acquired purpura fulminans,"acquired purpura fulminans, is a rapidly progressive, life-threatening thrombotic disorder that typically follows severe infections and is marked by disseminated intravascular coagulation causing widespread purpuric skin lesions and necrosis.",True
legionellosis,"legionellosis, a bacterial infection caused by Legionella species that can range from a mild flu-like illness (Pontiac fever) to a severe, potentially fatal pneumonia (Legionnaires' disease) contracted through inhaling contaminated water droplets.",True
intracranial embolism,"intracranial embolism, a blockage in a brain artery—often caused by a traveling blood clot, fat, or air bubble—that disrupts blood flow and can lead to stroke and related neurological symptoms.",True
nephritis,"nephritis, an inflammation of kidney tissues—including the glomeruli and tubules—that can alter urine function and potentially lead to kidney failure.",True
Huntington disease,"Huntington disease, a genetic neurodegenerative disorder marked by progressive motor, cognitive, and psychiatric decline due to the gradual loss of brain cells.",True
hypogonadotropic hypogonadism-frontoparietal alopecia syndrome,"hypogonadotropic hypogonadism-frontoparietal alopecia syndrome, a genetic disorder characterized by hypogonadotropic hypogonadism combined with distinctive frontoparietal alopecia and sparse secondary hair.",True
preeclampsia,"preeclampsia, a pregnancy complication that typically develops after 20 weeks and is marked by high blood pressure, protein in the urine, and potential organ damage affecting both mother and baby.",True
Plasmodium malariae malaria,"Plasmodium malariae malaria, is a human parasitic infection caused by the Plasmodium malariae protozoan, which typically results in a generally benign malaria characterized by a quartan (every fourth day) fever cycle.",True
hyperprolactinemia (disease),"hyperprolactinemia (disease), a condition characterized by abnormally high levels of prolactin in the blood, often caused by pituitary tumors, hypothyroidism, or certain medications, leading to reproductive and other health issues.",True
acute erythroid leukemia,"acute erythroid leukemia, a rare subtype of acute myeloid leukemia characterized by a predominant erythroid proliferation, frequent TP53 mutations, pancytopenia, and poor clinical outcomes.",True
vasomotor rhinitis,"vasomotor rhinitis, a nonallergic inflammation of the nasal tissues that causes sneezing, congestion, and a runny nose in response to various triggers such as irritants, weather changes, or hormonal factors.",True
twin reversal arterial perfusion syndrome,"twin reversal arterial perfusion syndrome, a rare complication of monochorionic twin pregnancies in which one normally developed twin pumps blood via reversed arterial flow to sustain its malformed, nonfunctional co-twin.",True
skin disease,"skin disease, a condition affecting the integumentary system that can manifest as a range of symptoms—from acne and rashes to chronic inflammatory lesions and infections—necessitating accurate diagnosis and tailored treatment.",True
ovarian cancer,"ovarian cancer, a malignant tumor originating in the ovaries that rapidly multiplies and can invade healthy tissues, often requiring treatments such as surgery and chemotherapy.",True
familial hyperlipidemia,"familial hyperlipidemia, an inherited disorder that causes abnormally high levels of cholesterol and triglycerides in the blood, significantly increasing the risk of premature cardiovascular events if not detected and managed early.",True
X-linked intellectual disability with isolated growth hormone deficiency,"X-linked intellectual disability with isolated growth hormone deficiency, is a rare X-linked recessive disorder characterized by early-onset intellectual impairment and isolated growth hormone deficiency leading to short stature without other significant endocrine abnormalities.",True
keloid,"keloid, a condition characterized by an excessive deposition of collagen leading to raised, thick, and irregular scars that extend beyond the original wound boundaries.",True
staphylococcus aureus infection,"staphylococcus aureus infection, a bacterial illness caused by Staphylococcus aureus that can range from minor skin issues to serious systemic complications, including antibiotic-resistant strains like MRSA.",True
corneal deposit,"corneal deposit, an ocular condition marked by the accumulation of substances within the corneal layers—often from medications, systemic diseases, or metabolic disorders—that may lead to opacities and visual impairment.",True
Escherichia coli meningitis,"Escherichia coli meningitis, is a severe central nervous system infection primarily affecting neonates, caused by E. coli bacteria invading the meninges and often linked to significant morbidity, mortality, and emerging antibiotic resistance.",True
autosomal dominant Emery-Dreifuss muscular dystrophy,"autosomal dominant Emery-Dreifuss muscular dystrophy, a rare genetic disorder caused primarily by mutations in the LMNA gene, is characterized by early joint contractures, progressive skeletal muscle weakness, and potentially life-threatening cardiac abnormalities.",True
lichen planus,"lichen planus, a chronic inflammatory condition characterized by purple, itchy bumps on the skin and lacy white patches in the mouth and other mucosal areas.",True
acquired aneurysmal subarachnoid hemorrhage,"acquired aneurysmal subarachnoid hemorrhage, a rare and life-threatening neurologic condition caused by the sudden rupture of an intracranial aneurysm into the subarachnoid space that typically presents with an abrupt, severe headache accompanied by symptoms such as nausea, vomiting, and potential neurologic deficits.",True
visual epilepsy,"visual epilepsy, a form of epilepsy in which seizures are triggered by visual stimuli such as flashing lights, fast-moving images, or contrasting patterns.",True
myofibroma,"myofibroma, a benign tumor of myofibroblastic origin characterized by spindle-shaped cells that typically presents in infants and young children as solitary or multicentric nodules, often requiring immunohistochemical analysis for definitive diagnosis.",True
spindle cell hemangioma,"spindle cell hemangioma, a rare benign vascular tumor typically occurring in the dermis or subcutis of the extremities, is characterized by cavernous blood vessels interspersed with spindle cells and may appear as solitary or multiple lesions associated with vascular anomalies.",True
X-linked recessive ocular albinism,"X-linked recessive ocular albinism, a genetic disorder caused by mutations in the GPR143 gene on the X chromosome, primarily affects males by leading to ocular hypopigmentation, foveal hypoplasia, nystagmus, photophobia, and reduced visual acuity while sparing skin and hair pigmentation.",True
gnathomiasis,"gnathomiasis, a parasitic infection caused by the third-stage larvae of Gnathostoma nematodes transmitted through consumption of undercooked or contaminated animal products, characterized by migratory subcutaneous swellings and potential systemic involvement.",True
genital herpes,"genital herpes, a common sexually transmitted infection caused by HSV-1 or HSV-2 that results in genital sores or blisters and can be spread through skin-to-skin contact even when symptoms are mild or absent.",True
splenic disease,"splenic disease, a condition affecting the spleen—often manifesting as enlargement (splenomegaly) due to infections, liver disorders, blood diseases, autoimmune issues, or cancers—that may present with few or nonspecific symptoms.",True
eunuchism,"eunuchism, the condition resulting from male castration that leads to the loss of reproductive and sexual functions, historically practiced for social and cultural roles in various societies.",True
neuroblastoma,"neuroblastoma, a cancer that develops from immature nerve cells and primarily affects young children, especially those under age 5.",True
enterocolitis (disease),"enterocolitis (disease), an inflammatory condition affecting both the small intestine and colon that commonly causes diarrhea, vomiting, and abdominal pain due to factors such as infections, autoimmune reactions, or food allergy responses.",True
gastroenteritis,"gastroenteritis, an inflammation of the stomach and intestines often caused by viral, bacterial, or parasitic infections that results in diarrhea, vomiting, and abdominal discomfort.",True
myalgia-eosinophilia syndrome associated with tryptophan,"myalgia-eosinophilia syndrome associated with tryptophan, a rare multisystem disorder characterized by subacute onset of muscle pain and peripheral eosinophilia that may progress to chronic neuropathy and skin induration after ingestion of L-tryptophan.",True
altitude sickness,"altitude sickness, a condition caused by low oxygen and low pressure at high altitudes that results in symptoms ranging from mild headache and nausea to severe, potentially life-threatening brain and lung edema.",True
"chronic eosinophilic leukemia, not otherwise specified","chronic eosinophilic leukemia, not otherwise specified, is a rare myeloproliferative neoplasm characterized by persistent clonal hypereosinophilia, the absence of defining genetic rearrangements, and an aggressive clinical course with a risk of progression to blast phase.",True
hemorrhoid,"hemorrhoid, a condition characterized by swollen and inflamed veins around the anus or lower rectum that can cause discomfort, pain, itching, and bleeding.",True
acute gonococcal cervicitis,"acute gonococcal cervicitis, an acute inflammatory condition of the cervix caused by Neisseria gonorrhoeae infection, typically presenting with abnormal vaginal discharge, intermenstrual bleeding, and pelvic pain.",True
leiomyosarcoma,"leiomyosarcoma, a rare and aggressive cancer originating in smooth muscle tissue that can affect various organs such as the uterus, abdomen, and blood vessels.",True
periodontitis,"periodontitis, a chronic inflammatory gum infection that damages the supporting tissues and bone of the teeth, potentially leading to tooth loss.",True
cholera,"cholera, an acute bacterial infection caused by Vibrio cholerae that is primarily transmitted through contaminated water or food and results in severe watery diarrhea and rapid dehydration that can be fatal if untreated.",True
atrial fibrillation (disease),"atrial fibrillation (disease), a common arrhythmia characterized by an irregular and often rapid heartbeat in the heart’s upper chambers that increases the risk of blood clots, stroke, and other heart-related complications.",True
adrenomyeloneuropathy,"adrenomyeloneuropathy, a rare X-linked inherited disorder that primarily affects the spinal cord—and sometimes the brain—resulting in progressive neurological symptoms such as muscle stiffness, weakness, and adrenal insufficiency.",True
hereditary persistence of fetal hemoglobin,"hereditary persistence of fetal hemoglobin, a benign genetic condition characterized by continued production of fetal hemoglobin into adulthood due to mutations that disrupt its normal shutdown.",True
holocarboxylase synthetase deficiency,"holocarboxylase synthetase deficiency, an autosomal recessive metabolic disorder caused by HLCS gene mutations that impair biotin activation of carboxylase enzymes and lead to disrupted protein, fat, and carbohydrate metabolism with symptoms typically presenting in infancy.",True
peritonsillar abscess,"peritonsillar abscess, a bacterial infection that causes a localized collection of pus to form in the tissue adjacent to the tonsils, often as a complication of tonsillitis.",True
Hurler-Scheie syndrome,"Hurler-Scheie syndrome, an intermediate form of mucopolysaccharidosis type I, is a rare genetic lysosomal storage disorder caused by insufficient breakdown of glycosaminoglycans that leads to progressive skeletal abnormalities, mild cognitive impairment, corneal clouding, and other systemic complications.",True
familial nephrotic syndrome,"familial nephrotic syndrome, a genetically heterogeneous kidney disorder caused by mutations affecting podocyte function and inherited in both autosomal dominant and recessive forms, which leads to severe proteinuria, hypoalbuminemia, edema, and hyperlipidemia.",True
bacterial meningitis caused by gram-negative bacteria,"bacterial meningitis caused by gram-negative bacteria, an acute inflammation of the meninges marked by high antibiotic resistance and elevated mortality rates, particularly in infants, that requires prompt and effective treatment for a chance at recovery.",True
cytomegalovirus retinitis,"cytomegalovirus retinitis, a serious viral infection of the retina occurring primarily in individuals with weakened immune systems that can lead to progressive vision loss or blindness if not treated promptly.",True
atrioventricular block (disease),"atrioventricular block (disease), is a condition in which the electrical signals between the heart’s upper and lower chambers are delayed or blocked, resulting in various degrees of arrhythmia and potential complications.",True
syphilis,"syphilis, a bacterial sexually transmitted infection that typically begins with a painless sore and can lead to serious health complications if untreated.",True
yolk sac tumor,"yolk sac tumor, a rare malignant germ cell tumor originating from embryonic yolk sac cells that typically affects reproductive organs and is often diagnosed through AFP testing, imaging, and biopsy, with treatment usually involving surgery and chemotherapy.",True
chlamydia infectious disease,"chlamydia infectious disease, a common sexually transmitted bacterial infection that is often asymptomatic but can lead to serious reproductive and other health complications if left untreated.",True
Wolman disease,"Wolman disease, a rare and severe genetic disorder caused by lysosomal acid lipase deficiency that disrupts fat metabolism, leading to organ enlargement, malabsorption, and early fatal complications in infancy.",True
male infertility due to obstructive azoospermia,"male infertility due to obstructive azoospermia, a condition where a blockage in the male reproductive tract prevents the normal transport of sperm, resulting in the complete absence of sperm in the ejaculate despite normal testicular production.",True
patent ductus arteriosus,"patent ductus arteriosus, a congenital heart defect in which the fetal vessel connecting the aorta and pulmonary artery fails to close after birth, leading to abnormal blood circulation.",True
hyperparathyroidism,"hyperparathyroidism, a condition in which one or more overactive parathyroid glands produce excessive parathyroid hormone, leading to elevated blood calcium levels and potential complications.",True
brain edema,"brain edema, is a serious condition marked by abnormal fluid accumulation in the brain that increases intracranial pressure and can result from trauma, stroke, infection, tumors, or other causes.",True
heparin-induced thrombocytopenia (disease),"heparin-induced thrombocytopenia (disease), is a life-threatening immune-mediated complication of heparin therapy characterized by a rapid drop in platelet counts and an increased risk of potentially fatal thromboembolic events.",True
brain ischemia,"brain ischemia, a condition of insufficient blood flow and oxygen to the brain that can lead to stroke, brain damage, or death.",True
arteriosclerosis obliterans,"arteriosclerosis obliterans, a chronic vascular disease caused by atherosclerosis that progressively narrows and occludes arteries in the abdomen and lower extremities, leading to limb ischemia and symptoms such as pain and numbness.",True
catecholaminergic polymorphic ventricular tachycardia,"catecholaminergic polymorphic ventricular tachycardia, a rare inherited arrhythmia syndrome characterized by stress-induced bidirectional or polymorphic ventricular tachycardia that can lead to syncope and sudden cardiac death.",True
hepatocellular carcinoma,"hepatocellular carcinoma, is the most common primary liver cancer that predominantly develops in patients with chronic liver disease, such as cirrhosis from hepatitis infections or metabolic dysfunction, and is known for its aggressive behavior.",True
microcytic anemia,"microcytic anemia, a condition characterized by abnormally small red blood cells with reduced hemoglobin, most commonly resulting from iron deficiency.",True
chronic Epstein-Barr virus infection syndrome,"chronic Epstein-Barr virus infection syndrome, a rare, potentially life-threatening disorder characterized by the body's inability to control Epstein-Barr virus, resulting in persistent mononucleosis-like symptoms, systemic inflammation, and clonal proliferation of infected T or NK cells.",True
thyroiditis (disease),"thyroiditis (disease), is an inflammatory condition of the thyroid gland commonly triggered by an autoimmune response that damages thyroid cells and disrupts hormone production.",True
subacute bursitis,"subacute bursitis, an intermediate-stage inflammation of a fluid-filled bursa near a joint that causes moderate pain, swelling, and restricted movement often due to repetitive strain or injury.",True
intracranial hypertension,"intracranial hypertension, a condition characterized by increased cerebrospinal fluid pressure inside the skull that can lead to headaches, vision problems, and other neurological symptoms.",True
chorioretinitis (disease),"chorioretinitis (disease), an inflammatory condition affecting both the choroid and retina that can result from infections such as toxoplasmosis, tuberculosis, and cytomegalovirus or be associated with systemic inflammatory disorders like Behçet's disease.",True
occupational dermatitis,"occupational dermatitis, a work-related skin condition caused by exposure to irritants and allergens in the workplace that can lead to chronic inflammation and significantly impair quality of life.",True
benign recurrent intrahepatic cholestasis,"benign recurrent intrahepatic cholestasis, a rare genetic liver disorder marked by intermittent episodes of cholestasis, jaundice, and pruritus that resolve spontaneously without causing progressive liver damage.",True
renal cell adenocarcinoma,"renal cell adenocarcinoma, a malignant tumor that originates in the kidney’s tubule lining and is the most common type of kidney cancer in adults.",True
thromboangiitis obliterans,"thromboangiitis obliterans, a rare, smoking-related inflammatory disease that causes clotting and blockage of small and medium arteries and veins in the extremities, leading to reduced blood flow, pain, ulcers, and potential limb loss.",True
inappropriate ADH syndrome,"inappropriate ADH syndrome, a condition characterized by the unsuppressed release or excessive action of antidiuretic hormone leading to water retention and hyponatremia.",True
G6PD deficiency,"G6PD deficiency, a genetic enzyme disorder that impairs red blood cells' ability to combat oxidative stress, leading to hemolytic anemia.",True
hypoaldosteronism disease,"hypoaldosteronism disease, an endocrine disorder characterized by insufficient aldosterone production or function that disrupts sodium and potassium balance, leading to hyperkalemia and a mild normal anion gap metabolic acidosis.",True
night blindness,"night blindness, a condition characterized by difficulty seeing in low-light environments due to various eye disorders, nutritional deficiencies, or other medical conditions.",True
Crimean-Congo hemorrhagic fever,"Crimean-Congo hemorrhagic fever, a severe tick-borne viral infection transmitted through animal contact that causes hemorrhagic symptoms and has a high fatality rate.",True
pneumococcal meningitis,"pneumococcal meningitis, a serious bacterial infection of the brain and spinal cord membranes caused by Streptococcus pneumoniae that can lead to life-threatening complications, particularly in young children, older adults, and individuals with weakened immune systems.",True
burn,"burn, an injury to skin and underlying tissues caused by thermal, chemical, electrical, friction, or radiation exposure, with severity ranging from superficial first-degree burns to deep, life-threatening third-degree or higher burns.",True
chronic eosinophilic leukemia,"chronic eosinophilic leukemia, a rare chronic myeloproliferative neoplasm characterized by clonal proliferation of eosinophil precursors that leads to high eosinophil counts in the blood, bone marrow, and tissues, potentially causing organ damage.",True
posterior leukoencephalopathy syndrome,"posterior leukoencephalopathy syndrome, a neurological condition marked by swelling primarily in the brain's posterior white matter that can cause headaches, visual disturbances, seizures, and altered consciousness and is often reversible with prompt treatment.",True
calciphylaxis cutis,"calciphylaxis cutis, a rare, life-threatening condition characterized by calcium deposition in the small blood vessels of the skin and fatty tissue that leads to painful, necrotic ulcers and poses significant risks of infection and sepsis, particularly in patients with advanced kidney disease.",True
inborn disorder of purine or pyrimidine metabolism,"inborn disorder of purine or pyrimidine metabolism, a group of rare genetic conditions caused by enzyme deficiencies or overactivity that disrupt nucleotide synthesis, salvage, or degradation and lead to a broad spectrum of clinical manifestations including neurological, immunological, hematological, and renal abnormalities.",True
metastatic melanoma,"metastatic melanoma, an advanced form of skin cancer where cancer cells spread from the original tumor to distant organs such as the brain, lungs, or bones.",True
"COPD, severe early onset","COPD, severe early onset, is a progressive lung disease that develops in younger individuals—often due to genetic factors, impaired lung growth, or early life exposures—resulting in significantly reduced lung function and severe respiratory symptoms.",True
hemiparkinsonism-hemiatrophy syndrome,"hemiparkinsonism-hemiatrophy syndrome, a rare movement disorder characterized by unilateral body atrophy and slowly progressive, ipsilateral parkinsonian signs such as bradykinesia, rigidity, and tremor, often associated with early-life brain injury.",True
psychotic disorder,"psychotic disorder, an umbrella term for severe mental health conditions characterized by impaired reality testing, manifesting as delusions, hallucinations, and disorganized thinking.",True
dysentery,"dysentery, an intestinal infection caused by bacteria or parasites, is characterized by severe diarrhea with blood or mucus, abdominal pain, and fever, which can lead to dehydration if untreated.",True
Rocky mountain spotted fever,"Rocky mountain spotted fever, a severe tickborne bacterial infection caused by Rickettsia rickettsii that typically presents with sudden fever, headache, and rash and can be fatal without early antibiotic treatment.",True
lichen disease,"lichen disease, a chronic inflammatory and autoimmune condition that affects the skin, mucous membranes, nails, and hair, often presenting as purple, itchy, flat bumps on the skin and lacy white patches or painful sores in the mouth and genital areas.",True
McLeod neuroacanthocytosis syndrome,"McLeod neuroacanthocytosis syndrome, an X-linked recessive neurodegenerative disorder caused by mutations in the XK gene, primarily affects males with movement abnormalities, cognitive and psychiatric changes, acanthocytosis, and cardiac complications due to basal ganglia degeneration.",True
hypertrichosis (disease),"hypertrichosis (disease), a condition marked by abnormal excessive hair growth that can appear over the entire body or in specific areas and may be congenital or acquired.",True
neurotic disorder,"neurotic disorder, a mental health condition marked by excessive anxiety, chronic distress, and emotional instability that significantly interferes with daily functioning.",True
non-papillary transitional cell carcinoma of the bladder,"non-papillary transitional cell carcinoma of the bladder, a form of urothelial cancer characterized by a flat growth pattern of malignant cells in the bladder lining rather than forming outwardly projecting, papillary tumors.",True
