disease,description,success
Lown-Ganong-Levine syndrome,"Lown-Ganong-Levine syndrome, a rare cardiac pre-excitation disorder characterized by a short PR interval with normal QRS complexes on electrocardiogram and episodes of paroxysmal tachycardia due to an accessory conduction pathway bypassing the atrioventricular node.",True
choroiditis,"choroiditis, an inflammation of the choroid—a vascular layer behind the retina—that can lead to vision problems and is commonly associated with infections, autoimmune conditions, or ocular trauma.",True
measles,"measles, a highly contagious viral infection characterized by fever, a red rash, cough, and potential severe complications, especially in young children, which is preventable through vaccination.",True
nebulin-related early-onset distal myopathy,"nebulin-related early-onset distal myopathy, a rare autosomal recessive disorder characterized by slowly progressive early-onset weakness and atrophy of distal muscles, especially the lower leg extensors, finger extensors, and neck flexors.",True
carbamoyl phosphate synthetase I deficiency disease,"carbamoyl phosphate synthetase I deficiency disease, is a rare inherited urea cycle disorder caused by mutations in the CPS1 gene that disrupts the conversion of ammonia into urea, leading to toxic hyperammonemia and symptoms such as poor feeding, vomiting, lethargy, seizures, and potentially life-threatening neurological complications.",True
trichostrongylosis,"trichostrongylosis, a zoonotic infection caused by nematodes of the genus Trichostrongylus typically acquired through ingestion of infective larvae from contaminated produce or water that usually results in mild, often subclinical symptoms but may lead to gastrointestinal distress and anemia in heavy infections.",True
ancylostomiasis,"ancylostomiasis, a parasitic infection caused by hookworms such as Ancylostoma duodenale and Necator americanus that feed on intestinal blood, potentially leading to iron deficiency anemia and malnutrition.",True
ileus,"ileus, a temporary halt in intestinal movement leading to a functional blockage of the digestive tract that can result from surgery, infections, or other systemic conditions.",True
hereditary breast ovarian cancer syndrome,"hereditary breast ovarian cancer syndrome, is an inherited cancer predisposition syndrome characterized by a significantly increased risk of breast and ovarian cancers, along with other associated malignancies, often linked to mutations in genes such as BRCA1 and BRCA2.",True
adult-onset distal myopathy due to VCP mutation,"adult-onset distal myopathy due to VCP mutation, is a rare genetic disorder characterized by middle age-onset distal leg muscle weakness with anterior compartment atrophy leading to foot drop, without involvement of proximal or scapular muscles, and it may also include features such as rapidly progressive dementia, Paget disease of bone, and hand weakness.",True
nephrotic syndrome,"nephrotic syndrome, a kidney disorder characterized by significant protein loss in urine, low blood albumin, high cholesterol, and resulting swelling due to increased permeability of the renal glomeruli.",True
invasive ductal breast carcinoma,"invasive ductal breast carcinoma, the most common type of breast cancer, originates in the milk ducts and invades surrounding tissue, potentially spreading to other parts of the body.",True
phobic disorder,"phobic disorder, an anxiety disorder characterized by a persistent, excessive, and irrational fear of specific objects, situations, or environments that disrupts daily life.",True
Noonan syndrome,"Noonan syndrome, a genetic disorder that affects multiple body systems and often causes distinctive facial features, short stature, heart defects, and developmental delays.",True
Cryptococcal meningitis,"Cryptococcal meningitis, a potentially life-threatening fungal infection that inflames the membranes covering the brain and spinal cord, predominantly affects immunocompromised individuals and requires prompt, multi-agent antifungal treatment.",True
tibia fracture,"tibia fracture, a break in the larger shinbone often caused by high-energy injuries or overuse stress that requires proper diagnosis and treatment for effective healing.",True
uremia,"uremia, a serious medical condition resulting from kidney failure that causes a toxic buildup of waste products and leads to widespread metabolic, fluid, and electrolyte imbalances.",True
eumycotic mycetoma,"eumycotic mycetoma, a chronic, progressive deep fungal infection of the skin and subcutaneous tissues characterized by a painless mass, multiple discharging sinuses, and the presence of grain-like granules.",True
idiopathic interstitial pneumonia,"idiopathic interstitial pneumonia, a group of diffuse lung diseases of unknown cause characterized by interstitial inflammation and fibrosis that lead to progressive breathing difficulties and are differentiated by histopathologic patterns on lung biopsy.",True
tic disorder,"tic disorder, a neurological condition characterized by sudden, rapid, nonrhythmic movements or vocalizations that vary in frequency and severity and can impact daily functioning.",True
inherited ichthyosis,"inherited ichthyosis, a group of genetic skin disorders caused by mutations that disrupt keratinocyte function and skin barrier formation, resulting in widespread dry, thickened, and scaly skin.",True
central nervous system disease,"central nervous system disease, a condition affecting the brain and spinal cord through infections, tumors, autoimmune responses, degenerative changes, and vascular issues that disrupt essential neurological functions.",True
pyoderma gangrenosum,"pyoderma gangrenosum, is a rare, non-infectious inflammatory skin disorder marked by rapidly developing, painful ulcerations often associated with systemic and immune-related conditions.",True
squamous cell carcinoma of the corpus uteri,"squamous cell carcinoma of the corpus uteri, is an extremely rare cancer composed of squamous cells that typically affects postmenopausal women, presenting with abnormal vaginal discharge, dysfunctional bleeding, and pelvic pain, often associated with cervical stenosis and pyometra.",True
urinary bladder small cell neuroendocrine carcinoma,"urinary bladder small cell neuroendocrine carcinoma, a rare and highly aggressive neuroendocrine tumor representing approximately 0.5–1% of primary bladder malignancies, typically presents in older patients with a clinical course similar to small cell lung cancer.",True
hemosiderosis,"hemosiderosis, a disorder characterized by excessive accumulation of iron in tissues as hemosiderin, typically resulting from chronic bleeding, repeated transfusions, or increased iron absorption without necessarily causing immediate tissue damage.",True
cauda equina syndrome,"cauda equina syndrome, a rare but serious neurological disorder caused by compression of the nerve roots at the lower end of the spinal cord, which can lead to severe lower back pain, leg weakness, and bladder and bowel dysfunction requiring urgent treatment.",True
necrotizing ulcerative gingivitis,"necrotizing ulcerative gingivitis, an acute bacterial infection of the gums characterized by rapid onset of painful necrosis, ulceration, and bleeding of the interdental tissue often linked to poor oral hygiene, stress, and immune compromise.",True
thrombotic disease,"thrombotic disease, a condition characterized by the formation of blood clots within arteries or veins that can obstruct blood flow and lead to life-threatening complications such as heart attacks, strokes, and pulmonary embolisms.",True
tyrosinemia,"tyrosinemia, a rare inherited metabolic disorder that impairs the breakdown of the amino acid tyrosine, potentially leading to liver, kidney, and neurological complications.",True
Castleman disease,"Castleman disease, a rare disorder characterized by abnormal cell growth in lymph nodes that causes inflammation and noncancerous enlargement in either localized or systemic forms.",True
refractory anemia,"refractory anemia, a blood disorder characterized by the bone marrow’s inability to produce sufficient healthy red blood cells—often due to dysplastic changes or genetic defects affecting iron metabolism—resulting in chronic anemia and related symptoms.",True
skin carcinoma,"skin carcinoma, a common cancer characterized by the uncontrolled growth of mutated skin cells in the epidermis—often due to UV-induced DNA damage—that manifests in various subtypes requiring tailored diagnosis and treatment.",True
inherited acute myeloid leukemia,"inherited acute myeloid leukemia, a rare malignant hematologic disorder characterized by the clonal proliferation of myeloid blasts in the bone marrow and frequently associated with congenital genetic syndromes.",True
exudative vitreoretinopathy,"exudative vitreoretinopathy, a hereditary disorder characterized by abnormal development of retinal blood vessels that leads to peripheral retinal ischemia, neovascularization, and progressive vision loss.",True
dumping syndrome,"dumping syndrome, a condition in which food moves too quickly from the stomach into the small intestine, causing symptoms such as nausea, diarrhea, and blood sugar changes, often after stomach or esophageal surgery.",True
hyperpituitarism,"hyperpituitarism, a condition in which the pituitary gland produces an excess of one or more hormones, typically due to a tumor, leading to a variety of symptoms and complications.",True
Glanzmann thrombasthenia,"Glanzmann thrombasthenia, a rare genetic disorder caused by defects in the platelet integrin αIIbβ3 that impairs platelet aggregation and results in lifelong bleeding episodes.",True
tuberculous meningitis,"tuberculous meningitis, a severe bacterial infection of the meninges caused by Mycobacterium tuberculosis, which often presents with subacute symptoms and carries a high risk of serious neurological complications.",True
primary peritoneal serous/papillary carcinoma,"primary peritoneal serous/papillary carcinoma, a rare epithelial tumor of the peritoneum that clinically and histopathologically resembles serous ovarian papillary carcinoma.",True
hantavirus hemorrhagic fever with renal syndrome,"hantavirus hemorrhagic fever with renal syndrome, an acute viral zoonosis transmitted via aerosolized rodent excreta that causes fever, hemorrhage, and progressive renal failure through distinct clinical phases.",True
obsolete contact dermatitis caused by poison oak,"obsolete contact dermatitis caused by poison oak, a delayed type IV hypersensitivity reaction triggered by urushiol exposure that results in an intensely itchy, blistering rash on affected skin areas.",True
pulmonary valve stenosis,"pulmonary valve stenosis, a condition that narrows the valve between the heart and lungs, restricting blood flow and potentially causing complications.",True
precocious puberty,"precocious puberty, an early onset of the hormonal process leading to the development of secondary sexual characteristics before age 8 in girls and 9 in boys, which may result in physical changes and psychosocial challenges.",True
cerebral artery occlusion,"cerebral artery occlusion, a blockage in a brain artery that disrupts blood flow and can cause an ischemic stroke.",True
nephrogenic syndrome of inappropriate antidiuresis,"nephrogenic syndrome of inappropriate antidiuresis, a rare genetic disorder caused by activating mutations in the arginine vasopressin receptor type 2 that lead to constitutive receptor activation, resulting in water retention with euvolemic hypotonic hyponatremia despite low or undetectable plasma arginine vasopressin levels.",True
ovarian small cell carcinoma,"ovarian small cell carcinoma, a rare and aggressive ovarian cancer predominantly affecting young women and often associated with hypercalcemia and SMARCA4 mutations.",True
rheumatoid vasculitis,"rheumatoid vasculitis, a rare complication of long-term rheumatoid arthritis, is an autoimmune condition that causes inflammation and damage to small and medium-sized blood vessels, leading to symptoms such as skin rashes, ulcers, and potential systemic organ damage.",True
leukemia (disease),"leukemia (disease), a cancer of the blood and bone marrow characterized by the rapid proliferation of abnormal white blood cells that disrupt normal blood functions and can present in acute or chronic forms requiring timely treatment.",True
female breast carcinoma,"female breast carcinoma, a cancer originating in the breast's milk ducts or lobules that primarily affects women—especially those over 50—though it can also occur in men, and exists in both noninvasive and invasive forms with various subtypes.",True
trichinosis,"trichinosis, a parasitic disease caused by ingesting raw or undercooked meat infected with Trichinella roundworms that leads to gastrointestinal symptoms and muscle inflammation.",True
neurohypophyseal diabetes insipidus,"neurohypophyseal diabetes insipidus, a rare disorder of water balance caused by deficient antidiuretic hormone (vasopressin) secretion from the posterior pituitary, results in excessive urination and intense thirst.",True
ataxia-pancytopenia syndrome,"ataxia-pancytopenia syndrome, a rare genetic disorder caused by pathogenic mutations, is characterized by progressive cerebellar ataxia, variable pancytopenia, and an increased risk of bone marrow failure, myelodysplasia, and acute myeloid leukemia.",True
myofascial pain syndrome,"myofascial pain syndrome, a chronic musculoskeletal condition characterized by painful trigger points in muscles and fascia that may cause both localized and referred pain.",True
capillary disease,"capillary disease, a rare and potentially life-threatening disorder characterized by recurrent episodes of plasma and protein leakage from small blood vessels leading to sudden drops in blood pressure and generalized edema.",True
fallopian tube carcinoma,"fallopian tube carcinoma, a rare and aggressive cancer originating in the fallopian tubes that is often diagnosed at advanced stages due to subtle early symptoms and typically treated with surgical removal.",True
pulmonary tuberculosis,"pulmonary tuberculosis, a contagious bacterial infection primarily affecting the lungs, caused by Mycobacterium tuberculosis and spread through airborne droplets from coughing, sneezing, or talking.",True
letterer-Siwe disease,"letterer-Siwe disease, a severe, rapidly progressing multisystem form of Langerhans cell histiocytosis that primarily affects infants and young children by involving multiple organs such as the skin, bones, liver, spleen, and lungs.",True
prostate carcinoma,"prostate carcinoma, a malignant tumor that arises from the uncontrolled growth of cells in the prostate gland, making it one of the most common cancers in men worldwide.",True
cartilage disease,"cartilage disease, a spectrum of disorders affecting the structure and function of cartilage that can lead to inflammation, pain, and impaired joint movement, as seen in conditions like osteoarthritis and relapsing polychondritis.",True
paralytic ileus (disease),"paralytic ileus (disease), a condition marked by a temporary paralysis of intestinal muscles that disrupts peristalsis and results in a functional blockage of the digestive tract.",True
respiratory failure,"respiratory failure, a condition in which the lungs fail to adequately oxygenate the blood or remove carbon dioxide, leading to potentially life-threatening symptoms.",True
obsolete atrophic vulva,"obsolete atrophic vulva, an outdated term describing the estrogen-deficiency condition characterized by thinning, dryness, and inflammation of the vulvar tissues that can lead to symptoms like itching, burning, and sexual discomfort.",True
AH amyloidosis,"AH amyloidosis, a rare form of immunoglobulin-related systemic amyloidosis, is characterized by the deposition of misfolded Ig heavy chain fragments as insoluble amyloid fibrils in various organs, most commonly the kidneys.",True
Treponema infectious disease,"Treponema infectious disease, a group of treponematoses including syphilis, yaws, endemic syphilis, and pinta, is caused by spiral-shaped Treponema bacteria transmitted through sexual contact or close skin-to-skin interaction.",True
myofibrillar myopathy,"myofibrillar myopathy, a group of genetic disorders characterized by progressive skeletal and sometimes cardiac muscle weakness resulting from mutations in muscle protein genes.",True
disease of neck of urinary bladder,"disease of neck of urinary bladder, a condition where narrowing or blockage at the junction between the bladder and urethra impedes the normal outflow of urine and may lead to symptoms such as a weak stream, incomplete emptying, and potential complications like urinary tract infections and kidney issues.",True
vitamin B12 deficiency,"vitamin B12 deficiency, a condition caused by insufficient intake or absorption of vitamin B12 that disrupts red blood cell production and leads to anemia, neurological issues, cognitive impairment, and other systemic symptoms.",True
small cell lung carcinoma,"small cell lung carcinoma, a rare and aggressive lung cancer strongly linked to tobacco smoking that is characterized by rapid growth, early spread, and a poor prognosis.",True
autosomal dominant familial periodic fever,"autosomal dominant familial periodic fever, is an inherited autoinflammatory disorder characterized by recurrent episodes of fever, abdominal pain, and localized inflammatory symptoms resulting from genetic mutations that follow a dominant inheritance pattern and often respond to corticosteroid treatment.",True
Rowell syndrome,"Rowell syndrome, a rare disorder characterized by the coexistence of lupus erythematosus and erythema multiforme-like lesions with a distinctive immunologic profile including a speckled antinuclear antibody pattern, positive anti-Ro/SSA or anti-La/SSB, and rheumatoid factor.",True
familial myoclonic epilepsy,"familial myoclonic epilepsy, an autosomal dominant disorder characterized by cortical tremors, myoclonic jerks, and occasional generalized seizures typically beginning in adolescence or adulthood.",True
interstitial nephritis,"interstitial nephritis, a kidney condition marked by inflammation and swelling of the tubules and surrounding tissue that can be acute or chronic and is often triggered by drug reactions, infections, or autoimmune disorders.",True
rare idiopathic male infertility,"rare idiopathic male infertility, a condition characterized by unexplained poor semen quality and reduced sperm count often linked to rare genetic mutations and chromosomal anomalies.",True
acute myeloid leukemia with t(9;11)(p22;q23),"acute myeloid leukemia with t(9;11)(p22;q23), is an AML subtype defined by the MLL-MLLT3 fusion resulting from a translocation between chromosomes 9 and 11, typically exhibiting monocytic features and a relatively favorable prognosis compared to other 11q23 rearrangements.",True
Fabry disease,"Fabry disease, a rare X-linked lysosomal storage disorder caused by alpha-galactosidase A deficiency that leads to the accumulation of sphingolipids in multiple organs, resulting in symptoms such as pain, kidney failure, heart problems, and characteristic skin lesions.",True
optic papillitis,"optic papillitis, is a type of optic neuritis characterized by inflammation of the optic nerve head that can lead to visual disturbances, pain, and sensitivity to light, and is often associated with systemic conditions such as multiple sclerosis.",True
spinal muscular atrophy-progressive myoclonic epilepsy syndrome,"spinal muscular atrophy-progressive myoclonic epilepsy syndrome, a rare inherited neurodegenerative disorder characterized by childhood-onset progressive muscle wasting that later develops into myoclonic seizures due to pathogenic genetic mutations.",True
porphyrin metabolism disease,"porphyrin metabolism disease, a group of rare inherited disorders resulting from enzyme defects in the heme biosynthetic pathway that cause an abnormal accumulation of porphyrin precursors and a range of symptoms including photosensitivity, neurological issues, liver dysfunction, and anemia.",True
diabetic retinopathy,"diabetic retinopathy, a diabetes complication that damages the blood vessels in the retina and can lead to vision loss.",True
hepatitis C virus infection,"hepatitis C virus infection, a viral liver disease caused by HCV that can lead to acute and chronic inflammation, potentially progressing to cirrhosis and liver cancer, and is primarily transmitted through infected blood.",True
pituitary adenocarcinoma (disease),"pituitary adenocarcinoma (disease), a rare malignant tumor of the pituitary gland that affects fewer than 1,000 people in the U.S. and can present with symptoms at any stage of life.",True
acute urate nephropathy,"acute urate nephropathy, a rapidly progressive acute kidney injury caused by the deposition of uric acid crystals in the renal tubules due to high uric acid levels from rapid cell turnover or increased production.",True
papillary renal cell carcinoma,"papillary renal cell carcinoma, a type of kidney cancer that originates in the renal tubules and is characterized by finger-like tumor projections, distinct genetic profiles, and varying clinical behavior.",True
placental abruption (disease),"placental abruption (disease), a serious obstetric condition in which the placenta prematurely detaches from the uterine wall—often during the third trimester—leading to potential vaginal bleeding, abdominal pain, and risks for both mother and baby.",True
keratoconjunctivitis,"keratoconjunctivitis, an inflammation affecting both the cornea and conjunctiva that can be triggered by infectious agents, allergens, and environmental irritants.",True
diabetes mellitus (disease),"diabetes mellitus (disease), a chronic metabolic disorder marked by high blood sugar levels caused by insufficient insulin production or ineffective insulin use, which can lead to complications affecting various organ systems.",True
interstitial cystitis,"interstitial cystitis, a chronic bladder condition of unknown cause characterized by persistent pelvic pain, pressure, and frequent urination.",True
primary intralymphatic angioendothelioma,"primary intralymphatic angioendothelioma, a rare vascular tumor that typically presents as an ill-defined, slowly growing asymptomatic cutaneous plaque or nodule on the limbs and is histologically characterized by lymphatic-like channels with prominent intraluminal papillary tufts with hyaline cores.",True
migraine disorder,"migraine disorder, a genetically influenced neurological condition characterized by recurrent, moderate-to-severe headache episodes often accompanied by nausea, light and sound sensitivity, and other sensory symptoms.",True
pulmonary eosinophilia,"pulmonary eosinophilia, a group of disorders marked by an abnormal accumulation of eosinophils in the lung tissues and airways that can arise from various infectious, drug-induced, parasitic, autoimmune, or idiopathic causes.",True
bone disease,"bone disease, a term for a group of disorders that weaken and alter the structure of bones—ranging from osteoporosis and osteoarthritis to bone cancers—resulting in increased fragility and a higher risk of fractures.",True
irritable bowel syndrome,"irritable bowel syndrome, a common gastrointestinal disorder characterized by abdominal pain, bloating, and alterations in bowel habits often influenced by stress or dietary factors.",True
dermatophytosis,"dermatophytosis, a fungal infection of the skin, hair, and nails characterized by red, itchy, and scaly rashes often with a ring-like pattern.",True
delusional disorder,"delusional disorder, a mental illness characterized by persistent, false beliefs that persist despite contrary evidence, typically without the additional psychotic symptoms seen in conditions like schizophrenia.",True
cognitive disorder,"cognitive disorder, a category of mental health conditions that impair cognitive functions such as memory, learning, and problem-solving due to factors like aging, injury, disease, or genetic influences.",True
male infertility due to sperm disorder,"male infertility due to sperm disorder, a condition marked by abnormalities in the production, structure, or motility of sperm that impede conception.",True
narcissistic personality disorder,"narcissistic personality disorder, a mental health condition marked by an inflated sense of self-importance, a constant need for admiration, and a lack of empathy that disrupts relationships.",True
"dermatitis, atopic","dermatitis, atopic, is a chronic inflammatory skin condition characterized by dry, itchy, and inflamed skin that often begins in childhood and may persist with intermittent flare-ups.",True
Acanthamoeba keratitis,"Acanthamoeba keratitis, a rare and serious eye infection caused by a microscopic protozoan that invades the cornea—often linked to contact lens use and exposure to contaminated water—can lead to vision loss if not diagnosed and treated early.",True
Stevens-Johnson syndrome,"Stevens-Johnson syndrome, a rare and serious condition characterized by skin and mucous membrane blistering, peeling, and inflammation usually triggered by medications or infections, often requires prompt hospitalization.",True
hepatic veno-occlusive disease,"hepatic veno-occlusive disease, a potentially life-threatening condition characterized by the obstruction of small intra-hepatic venules leading to hepatomegaly, ascites, and jaundice, often occurring after chemotherapy or hematopoietic stem cell transplantation.",True
Parkinson disease,"Parkinson disease, a progressive neurodegenerative disorder that impairs dopamine-producing neurons and results in tremors, stiffness, slowed movement, and various non-motor symptoms.",True
