disease,description,success
hereditary angioedema with C1Inh deficiency,"hereditary angioedema with C1Inh deficiency, is a rare autosomal dominant disorder characterized by recurrent, unpredictable episodes of non-urticarial subcutaneous and mucosal swelling—including potentially life-threatening airway edema—resulting from a deficiency or dysfunction of the C1 esterase inhibitor.",True
breast ductal adenocarcinoma,"breast ductal adenocarcinoma, a common invasive breast cancer that originates in the milk ducts and often spreads to surrounding tissues.",True
typhoid fever,"typhoid fever, an acute infectious disease caused by Salmonella enterica serotype Typhi that is typically spread through contaminated food and water and characterized by a gradual onset of high fever and systemic symptoms.",True
alcohol withdrawal delirium,"alcohol withdrawal delirium, also known as delirium tremens, is a life-threatening manifestation of alcohol withdrawal characterized by severe autonomic instability, confusion, hallucinations, and seizures that typically occurs within 2–3 days after abrupt cessation of long-term heavy alcohol use.",True
necrotizing enterocolitis,"necrotizing enterocolitis, a life-threatening inflammatory disease of the intestines primarily affecting premature infants and characterized by tissue necrosis, potential intestinal perforation, and high mortality.",True
dilated cardiomyopathy,"dilated cardiomyopathy, a progressive heart muscle disease in which the heart chambers enlarge and the walls thin, impairing the heart's ability to pump blood effectively.",True
lingual-facial-buccal dyskinesia,"lingual-facial-buccal dyskinesia, a movement disorder characterized by involuntary, repetitive, and stereotyped movements of the tongue, face, and buccal region often associated with long-term exposure to dopamine receptor blocking agents.",True
mevalonate kinase deficiency,"mevalonate kinase deficiency, a rare genetic autoinflammatory disorder caused by mutations in the MVK gene that disrupt cholesterol and isoprenoid biosynthesis and lead to recurrent fevers, joint pain, skin lesions, and elevated immunoglobulin D levels.",True
oophoritis,"oophoritis, inflammation of one or both ovaries often caused by bacterial infections or pelvic inflammatory disease that can compromise fertility if left untreated.",True
diastolic heart failure,"diastolic heart failure, a condition in which the left ventricle becomes stiff and unable to relax properly, impairing the heart's ability to fill with blood efficiently.",True
incessant infant ventricular tachycardia,"incessant infant ventricular tachycardia, is a rare form of ventricular tachycardia in infants characterized by persistent ventricular-origin tachycardia occurring more than 10% of a 24-hour period, with affected patients ranging from asymptomatic to presenting with congestive heart failure.",True
non-infectious diarrheal disease,"non-infectious diarrheal disease, a condition characterized by the passage of loose stools triggered by non-infectious causes such as inflammatory bowel disorders, malabsorption syndromes, and other chronic gastrointestinal diseases.",True
colitis (disease),"colitis (disease), an inflammatory condition of the colon characterized by swelling, irritation, and ulceration that can arise from infections or evolve into chronic inflammatory bowel diseases like ulcerative colitis.",True
depersonalization disorder,"depersonalization disorder, a mental health condition characterized by persistent or recurrent feelings of detachment from oneself or one's surroundings.",True
hypersplenism (disease),"hypersplenism (disease), an overactive spleen condition in which blood cells are prematurely destroyed, potentially causing anemia and other cytopenias, often linked to underlying conditions such as liver disease, infections, or cancer.",True
pancreatic adenocarcinoma,"pancreatic adenocarcinoma, the most common form of pancreatic cancer that arises from the ductal cells of the pancreas and is known for its aggressive behavior and challenging detection and treatment.",True
cerebral infarction,"cerebral infarction, a type of ischemic stroke caused by a blockage in cerebral blood flow that leads to brain tissue death, is a major contributor to neurological deficits, disability, and mortality.",True
amebiasis,"amebiasis, a parasitic intestinal infection caused by Entamoeba histolytica that can range from asymptomatic to severe disease with diarrhea, abdominal pain, and complications such as liver abscesses.",True
Crohn's colitis,"Crohn's colitis, a chronic inflammatory bowel disease affecting the large intestine, is characterized by recurring inflammation and gastrointestinal symptoms with no current cure.",True
central nervous system origin vertigo,"central nervous system origin vertigo, a condition caused by dysfunction in the brain's vestibular processing centers that impairs balance and spatial orientation, often resulting in severe imbalance and disorientation.",True
methemoglobinemia due to deficiency of methemoglobin reductase,"methemoglobinemia due to deficiency of methemoglobin reductase, an autosomal recessive disorder characterized by decreased oxygen-carrying capacity of the blood that results in cyanosis and hypoxia, with two clinical forms—type I, where the enzyme deficiency is restricted to erythrocytes, and type II, which involves a more generalized deficiency.",True
retiform hemangioendothelioma,"retiform hemangioendothelioma, a rare, slow-growing vascular neoplasm of intermediate malignancy characterized by a distinctive retiform pattern with hobnail endothelial cells, high local recurrence, and low metastatic potential.",True
thyroid crisis (disease),"thyroid crisis (disease), a rare and life-threatening complication of hyperthyroidism marked by a sudden, excessive release of thyroid hormones that causes rapid multisystem dysfunction.",True
idiopathic bronchiectasis,"idiopathic bronchiectasis, a chronic lung disease characterized by permanent bronchial dilation, recurrent infection, and impaired mucus clearance without a known cause.",True
primary cutaneous CD4+ small/medium-sized pleomorphic T-cell lymphoma,"primary cutaneous CD4+ small/medium-sized pleomorphic T-cell lymphoma, a rare and indolent cutaneous T-cell disorder presenting as solitary or localized nodules or plaques composed of pleomorphic small- to medium-sized CD4+ T-cells predominantly on the head, neck, or upper trunk with a favorable clinical course.",True
von Willebrand disease,"von Willebrand disease, a common genetic bleeding disorder caused by a deficiency or dysfunction of von Willebrand factor that impairs blood clotting and leads to prolonged bleeding.",True
intraoperative floppy iris syndrome,"intraoperative floppy iris syndrome, is a cataract surgery complication characterized by a flaccid, billowing iris that prolapses through incisions and progressively constricts during the procedure.",True
ichthyosis (disease),"ichthyosis (disease), is a group of genetic or acquired skin disorders characterized by dry, thickened, and scaly skin that can range in severity and may sometimes involve internal organs.",True
contact dermatitis,"contact dermatitis, an itchy inflammatory skin condition caused by direct contact with allergens or irritants.",True
beta-thalassemia HBB/LCRB,"beta-thalassemia HBB/LCRB, a genetic disorder caused by biallelic mutations or deletions affecting the HBB gene or its regulatory region, leading to reduced beta-globin production, microcytic hypochromic anemia, and a spectrum of clinical severities.",True
staphylococcal pneumonia,"staphylococcal pneumonia, a severe, rapidly progressing lung infection often following a viral illness that may produce necrotizing pneumonia, pleural complications, bacteremia, and sepsis.",True
chronic primary adrenal insufficiency,"chronic primary adrenal insufficiency, also known as Addison's disease, is a long-term endocrine disorder in which damage to the adrenal glands results in insufficient production of cortisol and aldosterone, potentially leading to life-threatening adrenal crises.",True
iatrogenic botulism,"iatrogenic botulism, a rare neuromuscular junction disorder caused by excessive botulinum toxin exposure from therapeutic or cosmetic procedures leading to descending flaccid paralysis.",True
familial recurrent peripheral facial palsy,"familial recurrent peripheral facial palsy, a rare peripheral neuropathy characterized by an acute onset of unilateral facial muscle weakness with Bell's phenomenon that resolves spontaneously and may recur without obvious precipitating factors.",True
coronary atherosclerosis,"coronary atherosclerosis, a condition characterized by the buildup of plaque in the coronary arteries that can restrict blood flow to the heart and lead to symptoms such as chest pain, heart attacks, or heart failure.",True
acute cystitis (disease),"acute cystitis (disease), is a sudden bacterial infection of the bladder, most often caused by E. coli, that results in painful urination, frequent urges to urinate, and lower abdominal discomfort.",True
goiter (disease),"goiter (disease), an abnormal enlargement of the thyroid gland often resulting from iodine deficiency or autoimmune conditions such as Graves' or Hashimoto's disease that can affect thyroid function.",True
laryngotracheal angioma,"laryngotracheal angioma, a rare benign vascular tumor that typically grows rapidly after birth—with partial spontaneous regression later—but can cause life-threatening airway obstruction due to its subglottic location.",True
radiodermatitis,"radiodermatitis, a common side effect of ionizing radiation treatment for cancer that causes skin redness, peeling, and, in severe cases, ulceration.",True
intermittent explosive disorder,"intermittent explosive disorder, a mental health condition characterized by sudden, impulsive outbursts of anger and aggression that are disproportionate to the triggering situation.",True
tibial muscular dystrophy,"tibial muscular dystrophy, a rare autosomal dominant late-onset distal myopathy that causes progressive weakness and wasting of the anterior lower leg muscles, leading to foot drop.",True
human prion disease,"human prion disease, a rare and fatal neurodegenerative disorder caused by abnormal prion proteins that disrupt brain function leading to rapid cognitive decline, movement impairments, and spongiform changes in the brain.",True
familial periodic paralysis,"familial periodic paralysis, a rare inherited neurological disorder characterized by sudden episodes of muscle weakness or paralysis due to mutations in sodium and calcium channel genes that impair electrolyte regulation.",True
chronic atrophic gastritis,"chronic atrophic gastritis, a condition of prolonged inflammation and thinning of the stomach lining, often caused by Helicobacter pylori infection or autoimmunity, that increases the risk of progressing to gastric cancer.",True
cyanide poisoning,"cyanide poisoning, a life-threatening condition caused by exposure to cyanide compounds that disrupt cellular oxygen utilization and can lead to rapid neurological and cardiovascular collapse.",True
chronic renal failure syndrome,"chronic renal failure syndrome, a progressive condition in which the kidneys gradually lose their ability to filter waste from the blood, eventually requiring dialysis or a transplant to sustain life.",True
gynecomastia,"gynecomastia, a benign condition characterized by the non-cancerous enlargement of male breast tissue due to hormonal imbalances during periods of hormonal change, medication use, or underlying health issues.",True
osteomyelitis (disease),"osteomyelitis (disease), an infection of bone tissue that can occur acutely or chronically, typically caused by bacteria entering the bone via the bloodstream, adjacent infected tissue, or direct trauma.",True
folliculotropic mycosis fungoides,"folliculotropic mycosis fungoides, a subtype of cutaneous T-cell lymphoma characterized by atypical T-cell infiltration of hair follicles with distinct clinical and histopathological features.",True
pityriasis versicolor,"pityriasis versicolor, a common superficial fungal infection caused by an overgrowth of yeast that produces asymptomatic, discolored patches on the trunk, neck, and arms.",True
desmoplastic small round cell tumor,"desmoplastic small round cell tumor, a rare and aggressive soft tissue sarcoma that typically originates in the abdominal and pelvic regions of young males and is characterized by small round cancer cells embedded within a dense, fibrous (desmoplastic) stroma.",True
ocular hypertension,"ocular hypertension, a condition characterized by elevated intraocular pressure—typically above 21 mmHg—that can damage the optic nerve and increase the risk of developing glaucoma.",True
degeneration of macula and posterior pole,"degeneration of macula and posterior pole, is an age-related retinal disease that damages the central vision area by degrading the macula’s densely packed photoreceptors, typically presenting as a slowly-progressing dry form or a more rapid, visually impairing wet form.",True
basal ganglia disease,"basal ganglia disease, a condition marked by impaired motor control and involuntary movements, often accompanied by cognitive and emotional disturbances due to dysfunction within the brain's basal ganglia.",True
kidney disease,"kidney disease, a condition in which damaged kidneys lose their ability to effectively filter waste from the blood, potentially progressing to kidney failure if untreated.",True
HER2 positive breast carcinoma,"HER2 positive breast carcinoma, is a type of breast cancer characterized by an overexpression of the HER2 protein that promotes rapid tumor growth and spread while often responding effectively to targeted therapies.",True
leiomyoma,"leiomyoma, a benign smooth muscle tumor most commonly found in the uterus that can be asymptomatic or cause symptoms such as pain, bleeding, and fertility issues.",True
urinary tract infection (disease),"urinary tract infection (disease), a common bacterial infection that affects any part of the urinary system—typically occurring when bacteria migrate from the skin or rectum through the urethra into the bladder and sometimes beyond.",True
thalassemia,"thalassemia, a genetic blood disorder caused by mutations that impair hemoglobin production and result in anemia.",True
opsoclonus-myoclonus syndrome,"opsoclonus-myoclonus syndrome, a rare neurological disorder characterized by rapid involuntary eye movements, muscle jerks, ataxia, and behavioral disturbances often triggered by infections, tumors, or autoimmune responses.",True
purpura fulminans,"purpura fulminans, a rare and life-threatening condition marked by rapid microvascular clotting that results in skin necrosis and hemorrhage, often triggered by severe infections or congenital protein deficiencies.",True
myiasis,"myiasis, a parasitic infestation in which fly larvae invade and feed on the living or necrotic tissue of humans or animals, leading to skin, wound, or organ infections.",True
acute liver failure,"acute liver failure, a rapid and severe loss of liver function in patients without preexisting liver disease that leads to life-threatening complications such as encephalopathy and coagulopathy.",True
pituitary tumor,"pituitary tumor, benign growths in the pituitary gland that can disrupt hormone production and cause symptoms ranging from vision changes to headaches due to pressure on adjacent structures.",True
neuromuscular junction disease,"neuromuscular junction disease, a disorder affecting the synapse between motor nerves and muscles where genetic, autoimmune, or toxic factors disrupt acetylcholine signaling, leading to impaired muscle contraction and weakness.",True
lysosomal acid lipase deficiency,"lysosomal acid lipase deficiency, a rare autosomal recessive metabolic disorder caused by mutations in the LIPA gene that impair fat breakdown in lysosomes, leading to harmful lipid accumulation in organs such as the liver and spleen.",True
Alzheimer disease,"Alzheimer disease, a neurodegenerative disorder marked by progressive memory loss, cognitive decline, and accumulation of amyloid plaques and neurofibrillary tangles in the brain, is the leading cause of dementia primarily affecting older adults.",True
baylisascariasis,"baylisascariasis, a rare and serious zoonotic infection caused by ingesting Baylisascaris procyonis larvae from raccoon feces that can result in severe neurologic, ocular, and systemic disease in humans.",True
pneumonia,"pneumonia, an infection of the lungs that inflames the air sacs, often filling them with fluid or pus and causing symptoms such as cough, fever, and difficulty breathing.",True
Berardinelli-Seip congenital lipodystrophy,"Berardinelli-Seip congenital lipodystrophy, a rare autosomal recessive disorder evident at birth, is characterized by a near-total absence of adipose tissue that leads to abnormal fat storage in muscle and liver, insulin resistance, and early-onset metabolic complications such as diabetes mellitus.",True
X-linked mixed deafness with perilymphatic gusher,"X-linked mixed deafness with perilymphatic gusher, a rare non-syndromic X-linked recessive disorder affecting males, is characterized by congenital inner ear anomalies—such as a dilated internal auditory canal and an abnormal cochlear connection—that result in progressive mixed (conductive and sensorineural) hearing loss and a perilymphatic fluid gusher during stapes surgery.",True
scalp dermatosis,"scalp dermatosis, a common inflammatory skin condition marked by flaky, greasy, and sometimes red patches on the scalp that may extend to adjacent sebaceous areas such as the face, ears, and chest.",True
paracoccidioidomycosis,"paracoccidioidomycosis, a systemic fungal infection endemic to Central and South America caused by thermodimorphic fungi of the genus Paracoccidioides that primarily affects the lungs and mucous membranes, leading to lesions, fever, and weight loss, and is treated with antifungal medications.",True
hemicrania continua,"hemicrania continua, a rare but treatable primary headache disorder characterized by continuous unilateral pain that responds to indomethacin.",True
erythema infectiosum,"erythema infectiosum, is a common viral infection caused by parvovirus B19 that primarily affects children by producing a distinctive red ""slapped-cheek"" rash.",True
exanthema subitum,"exanthema subitum, a common viral infection primarily affecting infants and young children that causes a sudden high fever followed by a rash.",True
cervicitis (disease),"cervicitis (disease), is an inflammation of the cervix typically caused by sexually transmitted infections or irritants, which may result in abnormal discharge, pain, and bleeding and can progress to serious complications like pelvic inflammatory disease and infertility.",True
gonorrhea,"gonorrhea, is a sexually transmitted infection caused by the bacterium Neisseria gonorrhoeae that spreads through sexual contact and can infect the genitals, rectum, mouth, and throat, potentially leading to serious complications if left untreated.",True
laryngeal squamous cell carcinoma,"laryngeal squamous cell carcinoma, a malignancy originating from the squamous cells lining the larynx, typically presents with symptoms such as hoarseness, persistent cough, and difficulty swallowing, with early detection being crucial for preserving function and improving prognosis.",True
impaired renal function disease,"impaired renal function disease, a condition in which the kidneys gradually lose their ability to filter waste and maintain fluid and electrolyte balance, potentially progressing to chronic kidney failure requiring dialysis or transplantation.",True
pyelonephritis,"pyelonephritis, a sudden and severe kidney infection usually caused by bacteria ascending from the urinary tract that leads to kidney inflammation, swelling, and potential life-threatening complications.",True
thyroid gland disease,"thyroid gland disease, is a condition in which the thyroid gland produces either too much or too little hormone, leading to metabolic imbalances and various systemic symptoms.",True
pituitary cancer,"pituitary cancer, a very rare malignant tumor of the pituitary gland that can disrupt hormone regulation and may lead to neurological symptoms when it invades surrounding tissues.",True
type 2 diabetes mellitus,"type 2 diabetes mellitus, a chronic metabolic disorder characterized by high blood sugar levels due to insulin resistance and relative insulin deficiency, increasingly affecting both older adults and youths and managed primarily through lifestyle changes and medications.",True
parkinsonian-pyramidal syndrome,"parkinsonian-pyramidal syndrome, a neurodegenerative disorder characterized by the simultaneous presence of parkinsonian features and pyramidal tract signs that is commonly linked to inherited genetic mutations.",True
serotonin syndrome,"serotonin syndrome, a potentially life-threatening condition caused by excessive serotonergic activity from medication use that results in symptoms ranging from agitation and rapid heart rate to seizures and muscle rigidity.",True
leptospirosis,"leptospirosis, a bacterial infection caused by Leptospira transmitted through water or soil contaminated by infected animal urine that can lead from mild flu-like symptoms to severe complications like kidney or liver failure and meningitis.",True
hyperbilirubinemia,"hyperbilirubinemia, a condition characterized by an excessive buildup of bilirubin in the blood due to increased red blood cell breakdown or impaired liver function, often manifesting as jaundice.",True
endometrial carcinoma (disease),"endometrial carcinoma (disease), a cancer of the uterine lining often driven by unopposed estrogen exposure, making it the most common uterine malignancy with various histological subtypes and treatment options.",True
inflammatory bowel disease,"inflammatory bowel disease, a group of chronic conditions in which an abnormal immune response causes persistent inflammation and damage to the gastrointestinal tract.",True
bacterial meningitis,"bacterial meningitis, a life-threatening bacterial infection that inflames the membranes surrounding the brain and spinal cord and requires immediate treatment.",True
rheumatic fever,"rheumatic fever, an inflammatory disease that develops after untreated group A streptococcal infections like strep throat or scarlet fever, potentially causing damage to the heart, joints, brain, and skin.",True
necrobiosis lipoidica,"necrobiosis lipoidica, a rare, chronic skin disorder often linked to diabetes that causes yellowish-brown plaques and ulcerating lesions primarily on the lower legs.",True
paracetamol poisoning,"paracetamol poisoning, is an acute overdose of paracetamol that leads to liver injury through the accumulation of its toxic metabolite, initially presenting with non-specific symptoms before potentially progressing to severe hepatic failure if left untreated.",True
hereditary thrombophilia due to congenital protein C deficiency,"hereditary thrombophilia due to congenital protein C deficiency, an inherited coagulation disorder caused by genetic mutations that reduce protein C activity and increase the risk of thrombotic events.",True
Wernicke-Korsakoff syndrome,"Wernicke-Korsakoff syndrome, a serious brain disorder primarily caused by thiamine (vitamin B1) deficiency often linked to chronic alcohol misuse, presents with symptoms of acute Wernicke encephalopathy (confusion, ataxia, and eye movement abnormalities) coupled with the chronic memory impairments associated with Korsakoff psychosis.",True
streptococcal pneumonia,"streptococcal pneumonia, a contagious bacterial infection caused by Streptococcus pneumoniae that primarily affects the lungs and can lead to serious complications such as meningitis and sepsis, especially in vulnerable populations.",True
drug dependence,"drug dependence, a condition in which an individual relies on one or more substances for normal functioning and experiences withdrawal symptoms when the substance is discontinued.",True
anterior horn disease,"anterior horn disease, a neurological condition characterized by the progressive loss of motor neurons in the anterior horn of the spinal cord leading to muscle weakness and atrophy.",True
water intoxication,"water intoxication, a potentially fatal condition caused by excessive water intake that disrupts the body's electrolyte balance, leading to brain cell swelling, confusion, seizures, and even coma.",True
histiocytoid cardiomyopathy,"histiocytoid cardiomyopathy, a rare genetic cardiac disorder primarily affecting infants and children—especially girls—that manifests with severe arrhythmias or dilated cardiomyopathy and is histologically characterized by abnormal Purkinje fibers and histiocyte-like myocardial cells.",True
fibrolamellar hepatocellular carcinoma,"fibrolamellar hepatocellular carcinoma, a rare liver cancer that predominantly affects young individuals with healthy livers and is distinguished by its unique histological features and clinical behavior from conventional hepatocellular carcinoma.",True
retinoblastoma,"retinoblastoma, a rare childhood eye cancer that develops in the retina—often linked to mutations in the RB1 gene.",True
neurofibromatosis,"neurofibromatosis, a genetic disorder characterized by the formation of tumors on nerves and skin, often accompanied by distinctive pigmentation changes, and classified into three main types with type 1 being the most common.",True
paronychia (disease),"paronychia (disease), is an infection or inflammation of the skin around the fingernails or toenails, often caused by bacteria, yeast, or fungi and presenting in either an acute or chronic form.",True
